{
    "id": "document-note",
    "schema": "$(frameworkRoot)/modules/document/visual/document-note/document-note.xsd",
    "template": "$(frameworkRoot)/modules/document/visual/document-note/template.xslt",
    "renderer": "$(frameworkRoot)/modules/document/visual/document-note/renderer.js",
    "styles": [],
    "scripts": [],
    "variants": [
        "default"
    ]
}
