{
    "id": "infobox",
    "schema": "$(frameworkRoot)/visual/infobox/infobox.xsd",
    "template": "$(frameworkRoot)/visual/infobox/template.xslt",
    "renderer": "$(frameworkRoot)/visual/infobox/renderer.js",
    "styles": [
        "$(frameworkRoot)/visual/infobox/infobox.css"
    ],
    "scripts": [],
    "variants": [
        "default",
        "info",
        "warning",
        "success",
        "error",
        "dark",
        "neutral"
    ]
}
