{
    "id": "document-section",
    "schema": "$(frameworkRoot)/modules/document/visual/document-section/document-section.xsd",
    "template": "$(frameworkRoot)/modules/document/visual/document-section/template.xslt",
    "renderer": "$(frameworkRoot)/modules/document/visual/document-section/renderer.js",
    "styles": [],
    "scripts": [],
    "variants": [
        "default"
    ]
}
