{
    "id": "collapse-box",
    "schema": "$(frameworkRoot)/visual/collapse-box/collapse-box.xsd",
    "template": "$(frameworkRoot)/visual/collapse-box/template.xslt",
    "renderer": "$(frameworkRoot)/visual/collapse-box/renderer.js",
    "styles": [
        "$(frameworkRoot)/visual/collapse-box/collapse-box.css"
    ],
    "scripts": [],
    "variants": [
        "default"
    ]
}
