{
    "id": "hero",
    "schema": "$(frameworkRoot)/visual/hero/hero.xsd",
    "template": "$(frameworkRoot)/visual/hero/template.xslt",
    "renderer": "$(frameworkRoot)/visual/hero/renderer.js",
    "styles": [
        "$(frameworkRoot)/visual/hero/hero.css"
    ],
    "scripts": [],
    "variants": [
        "default"
    ]
}
