{
    "id": "navbar",
    "schema": "$(frameworkRoot)/visual/navbar/navbar.xsd",
    "template": "$(frameworkRoot)/visual/navbar/template.xslt",
    "renderer": "$(frameworkRoot)/visual/navbar/renderer.js",
    "styles": [
        "$(frameworkRoot)/visual/navbar/navbar.css"
    ],
    "scripts": [
        "$(frameworkRoot)/visual/navbar/navbar.js"
    ],
    "variants": [
        "default"
    ]
}
